{
  "schema_version": "gateway_operator_return_summary_v1",
  "status": "attention",
  "open_event_count": 1,
  "latest_event": {
    "schema_version": "gateway_operator_return_event_v1",
    "event_id": "return-2b0f8d1a71ef",
    "timestamp_utc": "2026-03-26T18:40:00+00:00",
    "status": "open",
    "surface": "gateway",
    "reason_code": "gateway_snapshot_not_ready",
    "severity": "attention",
    "return_mode": "reprobe",
    "operator_visible": true,
    "anchor_refs": [
      {
        "artifact_kind": "startup_run",
        "label": "latest startup run",
        "ref": "runs/20260326_184000-start-operator-product/run.json",
        "ref_type": "path",
        "required": true
      }
    ],
    "recommended_safe_actions": [
      "gateway_http_core",
      "gateway_local_core"
    ],
    "triage_hint": "Re-probe the gateway operator snapshot and inspect the latest startup artifacts before continuing.",
    "loop_count": 1,
    "safe_stop_after": 2,
    "details": {
      "probe_error": "gateway operator snapshot not ready"
    }
  },
  "recommended_safe_actions": [
    "gateway_http_core",
    "gateway_local_core"
  ],
  "recent_reason_codes": [
    "gateway_snapshot_not_ready"
  ],
  "next_step_code": "run_safe_action",
  "next_step": "Run safe action gateway_http_core from the gateway operator surface.",
  "paths": {
    "latest_return_event_json": "runs/20260326_184000-start-operator-product/return/latest_return_event.json",
    "return_events_jsonl": "runs/20260326_184000-start-operator-product/return/return_events.jsonl"
  },
  "warnings": []
}
